{
  "id": "OP-002",
  "name": "Operation Iron Rain",
  "status": "development",
  "mission_maker": "Vector",
  "description": "Defend the Topolin logistics hub against waves of mechanized assaults while engineers repair the damaged bridge behind the line.",
  "map": "Livonia",
  "mission_type": "Defense",
  "difficulty": "standard",
  "estimated_duration_minutes": 90,
  "factions": [
    "NATO",
    "LDF",
    "Spetsnaz"
  ],
  "tags": [
    "defense",
    "armor",
    "daytime"
  ],
  "version": "0.3.0"
}
